PrimeHomey Realty,,,,,,
Date,Day,Content Type,Category,Caption,Content Idea,Hashtags
3-Mar,Monday,Carousel,Property Listing,Looking for a comfortable home in a prime location?  Swipe to explore this beautiful property.,2BHK property photos with features & price,#PrimeHomeyRealty #PropertyForSale #DreamHome #RealEstateIndia
5-Mar,Wednesday,Carousel,Home Buying Tips,Buying a home soon? Don’t miss these important checks before you decide.,5 things to check before buying a home,#HomeBuyingTips #RealEstateGuide #PrimeHomes
7-Mar,Friday,Static Post,Brand Awareness,"At PrimeHomey Realty, we help you find homes that truly feel right.",Brand intro + trust message,#TrustedRealty #PrimeHomey #HomeJourney
10-Mar,Monday,Carousel,Budget Education,Planning to buy a ?60L home? Let’s break down the real costs clearly.,Budget & EMI breakdown,#HomeBudget #RealEstateTips #SmartBuy
12-Mar,Wednesday,Carousel,Location Spotlight,Why is this location perfect for families and professionals? Swipe to know.,"Location benefits (schools, transport, safety)",#LocationMatters #PrimeLocation #CityHomes
14-Mar,Friday,Stories,Client Activity,Site visits in progress  Helping clients explore their future homes.,Client visit updates (3–4 stories),#SiteVisit #RealEstateLife
17-Mar,Monday,Carousel,Myth vs Fact,Think buying a home needs full cash? Let’s clear this myth today.,Real estate myth vs fact,#RealEstateMyths #HomeFacts #PrimeHomey
19-Mar,Wednesday,Carousel,Home Loan Tips,Want faster home loan approval? Follow these simple tips.,Home loan preparation checklist,#HomeLoanTips #PropertyGuide
21-Mar,Friday,Static Post,Available Property,New property available in [Location]. Limited units only.,Single property image + details,#PropertyAlert #HomesForSale
24-Mar,Monday,Carousel,Buyer Education,First-time home buyer? This post is for you.,Step-by-step buying process,#FirstTimeBuyer #HomePurchase
26-Mar,Wednesday,Stories,FAQs,Got questions about buying a home? We’re answering them today.,FAQ stories using Q&A sticker,#AskPrimeHomey #RealEstateHelp
28-Mar,Friday,Static Post,Brand Trust,"More than properties, we build trust and long-term relationships.",Client-first brand message,#TrustedBrand #PrimeHomeyRealty
